{
  "schemaVersion": "runtime-e2e-report-v1",
  "benchmark": "Runtime-E2E-GATE-30",
  "fixtureSeed": 20260819,
  "generatorVersion": "runtime-e2e-generator-v1",
  "shard": {
    "index": 1,
    "total": 1
  },
  "variants": [
    "baseline",
    "no-wal",
    "no-recovery",
    "no-lease"
  ],
  "runStartedAt": "2026-08-20T04:01:47.506Z",
  "implementation": {
    "check": "production-runtime",
    "persistence": "JsonFileRuntimePersistence",
    "runtimeClasses": [
      "AgentLoop",
      "AgentRunStore",
      "AgentRuntimeStore",
      "JsonFileRuntimePersistence",
      "ModelInvocationStartupRecovery",
      "ModelInvocationStore",
      "PersistentRuntimeLeaseStore",
      "ToolInvocationStore",
      "WorkflowTeamCoordinator"
    ],
    "protocolSimulatorUsed": false
  },
  "methodology": {
    "provider": {
      "kind": "deterministic-fake",
      "realApiCalls": false,
      "credentialsRead": false
    },
    "tool": {
      "kind": "deterministic-fake",
      "effects": "local-temporary-journal"
    },
    "latency": "measured local wall-clock; not production capacity",
    "claims": "implementation correctness only; not real-provider or production-capacity evidence"
  },
  "environment": {
    "platform": "win32",
    "arch": "x64",
    "node": "v20.19.0",
    "local": true
  },
  "summaries": [
    {
      "variant": "baseline",
      "cases": 30,
      "taskSuccess": {
        "count": 30,
        "total": 30,
        "rate": 1
      },
      "recoverySuccess": {
        "count": 30,
        "total": 30,
        "rate": 1
      },
      "duplicateModelCalls": 0,
      "duplicateToolEffects": 0,
      "unknownOutcome": {
        "count": 5,
        "total": 30,
        "rate": 0.166667
      },
      "evidenceCompleteness": 1,
      "wallClockMs": {
        "kind": "measured-local-wall-clock",
        "total": 2807.352,
        "p50": 74.293,
        "p95": 218.457
      }
    },
    {
      "variant": "no-wal",
      "cases": 30,
      "taskSuccess": {
        "count": 20,
        "total": 30,
        "rate": 0.666667
      },
      "recoverySuccess": {
        "count": 30,
        "total": 30,
        "rate": 1
      },
      "duplicateModelCalls": 10,
      "duplicateToolEffects": 5,
      "unknownOutcome": {
        "count": 10,
        "total": 30,
        "rate": 0.333333
      },
      "evidenceCompleteness": 1,
      "wallClockMs": {
        "kind": "measured-local-wall-clock",
        "total": 2079.353,
        "p50": 49.334,
        "p95": 174.26
      }
    },
    {
      "variant": "no-recovery",
      "cases": 30,
      "taskSuccess": {
        "count": 5,
        "total": 30,
        "rate": 0.166667
      },
      "recoverySuccess": {
        "count": 5,
        "total": 30,
        "rate": 0.166667
      },
      "duplicateModelCalls": 0,
      "duplicateToolEffects": 0,
      "unknownOutcome": {
        "count": 0,
        "total": 30,
        "rate": 0
      },
      "evidenceCompleteness": 0.5,
      "wallClockMs": {
        "kind": "measured-local-wall-clock",
        "total": 1575.746,
        "p50": 52.746,
        "p95": 87.999
      }
    },
    {
      "variant": "no-lease",
      "cases": 30,
      "taskSuccess": {
        "count": 23,
        "total": 30,
        "rate": 0.766667
      },
      "recoverySuccess": {
        "count": 23,
        "total": 25,
        "rate": 0.92
      },
      "duplicateModelCalls": 0,
      "duplicateToolEffects": 5,
      "unknownOutcome": {
        "count": 5,
        "total": 30,
        "rate": 0.166667
      },
      "evidenceCompleteness": 0.877778,
      "wallClockMs": {
        "kind": "measured-local-wall-clock",
        "total": 3756.834,
        "p50": 113.941,
        "p95": 267.061
      }
    }
  ],
  "cases": [
    {
      "caseId": "model-response-window-001",
      "caseIndex": 0,
      "scenarioSeed": 98352580,
      "family": "model-response-window",
      "checkpoint": "response-received",
      "variant": "baseline",
      "taskSuccess": true,
      "recoveryAttempted": true,
      "recoverySuccess": true,
      "snapshotReloaded": true,
      "stateFileWrites": 6,
      "stateFileLoads": 3,
      "modelCalls": 1,
      "duplicateModelCalls": 0,
      "toolEffects": 0,
      "duplicateToolEffects": 0,
      "unknownOutcome": false,
      "evidenceRequired": 3,
      "evidenceProduced": 3,
      "evidenceCompleteness": 1,
      "wallClockDurationMs": 44.435,
      "recoveryResult": "response-replayed-without-provider-reissue",
      "productionClasses": [
        "AgentLoop",
        "JsonFileRuntimePersistence",
        "ModelInvocationStore"
      ],
      "invariants": [
        "exactly-one-assistant-message",
        "snapshot-reloaded",
        "provider-call-count-audited"
      ],
      "failureCodes": []
    },
    {
      "caseId": "model-response-window-002",
      "caseIndex": 1,
      "scenarioSeed": 2009650837,
      "family": "model-response-window",
      "checkpoint": "response-received-replay",
      "variant": "baseline",
      "taskSuccess": true,
      "recoveryAttempted": true,
      "recoverySuccess": true,
      "snapshotReloaded": true,
      "stateFileWrites": 6,
      "stateFileLoads": 3,
      "modelCalls": 1,
      "duplicateModelCalls": 0,
      "toolEffects": 0,
      "duplicateToolEffects": 0,
      "unknownOutcome": false,
      "evidenceRequired": 3,
      "evidenceProduced": 3,
      "evidenceCompleteness": 1,
      "wallClockDurationMs": 42.268,
      "recoveryResult": "response-replayed-without-provider-reissue",
      "productionClasses": [
        "AgentLoop",
        "JsonFileRuntimePersistence",
        "ModelInvocationStore"
      ],
      "invariants": [
        "exactly-one-assistant-message",
        "snapshot-reloaded",
        "provider-call-count-audited"
      ],
      "failureCodes": []
    },
    {
      "caseId": "model-response-window-003",
      "caseIndex": 2,
      "scenarioSeed": 3180320736,
      "family": "model-response-window",
      "checkpoint": "committed-replay",
      "variant": "baseline",
      "taskSuccess": true,
      "recoveryAttempted": true,
      "recoverySuccess": true,
      "snapshotReloaded": true,
      "stateFileWrites": 6,
      "stateFileLoads": 3,
      "modelCalls": 1,
      "duplicateModelCalls": 0,
      "toolEffects": 0,
      "duplicateToolEffects": 0,
      "unknownOutcome": false,
      "evidenceRequired": 3,
      "evidenceProduced": 3,
      "evidenceCompleteness": 1,
      "wallClockDurationMs": 49.912,
      "recoveryResult": "response-replayed-without-provider-reissue",
      "productionClasses": [
        "AgentLoop",
        "JsonFileRuntimePersistence",
        "ModelInvocationStore"
      ],
      "invariants": [
        "exactly-one-assistant-message",
        "snapshot-reloaded",
        "provider-call-count-audited"
      ],
      "failureCodes": []
    },
    {
      "caseId": "model-response-window-004",
      "caseIndex": 3,
      "scenarioSeed": 3813970441,
      "family": "model-response-window",
      "checkpoint": "submitted-unknown",
      "variant": "baseline",
      "taskSuccess": true,
      "recoveryAttempted": true,
      "recoverySuccess": true,
      "snapshotReloaded": true,
      "stateFileWrites": 6,
      "stateFileLoads": 3,
      "modelCalls": 1,
      "duplicateModelCalls": 0,
      "toolEffects": 0,
      "duplicateToolEffects": 0,
      "unknownOutcome": false,
      "evidenceRequired": 3,
      "evidenceProduced": 3,
      "evidenceCompleteness": 1,
      "wallClockDurationMs": 54.104,
      "recoveryResult": "response-replayed-without-provider-reissue",
      "productionClasses": [
        "AgentLoop",
        "JsonFileRuntimePersistence",
        "ModelInvocationStore"
      ],
      "invariants": [
        "exactly-one-assistant-message",
        "snapshot-reloaded",
        "provider-call-count-audited"
      ],
      "failureCodes": []
    },
    {
      "caseId": "model-response-window-005",
      "caseIndex": 4,
      "scenarioSeed": 869683644,
      "family": "model-response-window",
      "checkpoint": "assistant-commit",
      "variant": "baseline",
      "taskSuccess": true,
      "recoveryAttempted": true,
      "recoverySuccess": true,
      "snapshotReloaded": true,
      "stateFileWrites": 6,
      "stateFileLoads": 3,
      "modelCalls": 1,
      "duplicateModelCalls": 0,
      "toolEffects": 0,
      "duplicateToolEffects": 0,
      "unknownOutcome": false,
      "evidenceRequired": 3,
      "evidenceProduced": 3,
      "evidenceCompleteness": 1,
      "wallClockDurationMs": 49.757,
      "recoveryResult": "response-replayed-without-provider-reissue",
      "productionClasses": [
        "AgentLoop",
        "JsonFileRuntimePersistence",
        "ModelInvocationStore"
      ],
      "invariants": [
        "exactly-one-assistant-message",
        "snapshot-reloaded",
        "provider-call-count-audited"
      ],
      "failureCodes": []
    },
    {
      "caseId": "tool-effect-window-001",
      "caseIndex": 5,
      "scenarioSeed": 1648174197,
      "family": "tool-effect-window",
      "checkpoint": "result-received",
      "variant": "baseline",
      "taskSuccess": true,
      "recoveryAttempted": true,
      "recoverySuccess": true,
      "snapshotReloaded": true,
      "stateFileWrites": 14,
      "stateFileLoads": 3,
      "modelCalls": 2,
      "duplicateModelCalls": 0,
      "toolEffects": 1,
      "duplicateToolEffects": 0,
      "unknownOutcome": false,
      "evidenceRequired": 3,
      "evidenceProduced": 3,
      "evidenceCompleteness": 1,
      "wallClockDurationMs": 106.816,
      "recoveryResult": "tool-result-replayed-without-effect-reissue",
      "productionClasses": [
        "AgentLoop",
        "JsonFileRuntimePersistence",
        "ModelInvocationStore",
        "ToolInvocationStore",
        "ToolRegistry"
      ],
      "invariants": [
        "exactly-one-tool-effect",
        "exactly-one-tool-result",
        "tool-wal-committed"
      ],